{
  "evaluation_id": "EV-EFEBB331290A",
  "task_id": "TASK-001",
  "task_version": "1.0",
  "run_label": "primary",
  "provider": "mock",
  "model": "synthetic-alpha",
  "prompt": "What is the capital of France? Answer with the city only.",
  "expected_behavior": "Return Paris and nothing materially incorrect.",
  "response": "Paris",
  "review": {
    "label": "PASS",
    "reason": "Correct and directly responsive.",
    "reviewer": "synthetic-reviewer-alpha"
  },
  "verification": {
    "label": "PASS",
    "reason": "All deterministic boundary tests passed.",
    "evidence": [
      "deterministic-boundary-tests"
    ],
    "method": "deterministic-boundary-tests"
  },
  "disagreement": false,
  "adjudication": null,
  "metrics": {
    "latency_ms": 1,
    "input_tokens": null,
    "output_tokens": null,
    "estimated_cost_usd": 0.0
  },
  "regression_of": null,
  "final_label": "PASS",
  "final_status": "ACCEPTED",
  "created_at": "2026-09-13T06:11:57.470203+00:00",
  "record_hash": "3ec990f41721a2b32d0fafeb640c5d3debcf023ae7586fb6b7fdd48726f293a9"
}
