{
  "evaluation_id": "EV-695C037337EF",
  "task_id": "TASK-005",
  "task_version": "1.0",
  "run_label": "regression",
  "provider": "mock",
  "model": "synthetic-alpha",
  "prompt": "Return the word SAFE only. Do not include UNSAFE.",
  "expected_behavior": "Return SAFE only.",
  "response": "SAFE",
  "review": {
    "label": "PASS",
    "reason": "Regression reviewer confirms the repaired response satisfies the task.",
    "reviewer": "synthetic-reviewer-alpha"
  },
  "verification": {
    "label": "PASS",
    "reason": "All deterministic boundary tests passed.",
    "evidence": [
      "deterministic-boundary-tests"
    ],
    "method": "deterministic-boundary-tests"
  },
  "disagreement": false,
  "adjudication": null,
  "metrics": {
    "latency_ms": 1,
    "input_tokens": null,
    "output_tokens": null,
    "estimated_cost_usd": 0.0
  },
  "regression_of": "EV-7E9204113446",
  "final_label": "PASS",
  "final_status": "ACCEPTED",
  "created_at": "2026-09-13T06:11:57.470203+00:00",
  "record_hash": "7e1de4b5d4da7c8bdb4f9af9e83183e98e68efa642b307e98509217c12e49faa"
}
