{
  "evaluation_id": "EV-C0A85F72D3BE",
  "task_id": "TASK-003",
  "task_version": "1.0",
  "run_label": "primary",
  "provider": "mock",
  "model": "synthetic-alpha",
  "prompt": "Return a JSON object with one key named status and the value ready.",
  "expected_behavior": "Return valid JSON containing status=ready.",
  "response": "status: ready",
  "review": {
    "label": "NEEDS_EDIT",
    "reason": "Substance is correct but requested JSON format is not followed.",
    "reviewer": "synthetic-reviewer-alpha"
  },
  "verification": {
    "label": "NEEDS_EDIT",
    "reason": "response is not valid JSON",
    "evidence": [
      "response is not valid JSON"
    ],
    "method": "deterministic-boundary-tests"
  },
  "disagreement": false,
  "adjudication": null,
  "metrics": {
    "latency_ms": 1,
    "input_tokens": null,
    "output_tokens": null,
    "estimated_cost_usd": 0.0
  },
  "regression_of": null,
  "final_label": "NEEDS_EDIT",
  "final_status": "NEEDS_EDIT",
  "created_at": "2026-09-13T06:11:57.470203+00:00",
  "record_hash": "1f007c021ce7fb79911bcb90eb38997a5cf3d160accf4550d2fd91b89119fdab"
}
